{
  "closed_debts": [
    "CONTROL-EVENT-G1",
    "F0-G1",
    "FDG-G1",
    "FENCE-G1",
    "IFU-ACCESS-G1",
    "IFU-AXI-G1",
    "IFU-FETCH-G2",
    "IFU-TVAL-G1",
    "INSTRET-G1",
    "MEM-ISSUE-G1",
    "MIQ-FLUSH-G1",
    "PTW-PMP-G1",
    "SERIALIZE-G1",
    "STORE-BRESP-G1",
    "VECTORED-TRAP-G1",
    "XRET-G1"
  ],
  "cohort_id": "full-core-single-hart-rv64-dual-issue-ooo-v1",
  "debt_status": {
    "A-COHERENCE-G1": "EXCLUDED_BY_COHORT",
    "CONTROL-EVENT-G1": "CLOSED_CURRENT_DESIGN",
    "DEBUG-TRIGGER-G1": "EXCLUDED_BY_COHORT",
    "F0-G1": "CLOSED_CURRENT_DESIGN",
    "FDG-G1": "CLOSED_CURRENT_DESIGN",
    "FENCE-G1": "CLOSED_CURRENT_DESIGN",
    "IFU-ACCESS-G1": "CLOSED_CURRENT_DESIGN",
    "IFU-AXI-G1": "CLOSED_CURRENT_DESIGN",
    "IFU-FETCH-G2": "CLOSED_CURRENT_DESIGN",
    "IFU-TVAL-G1": "CLOSED_CURRENT_DESIGN",
    "INSTRET-G1": "CLOSED_CURRENT_DESIGN",
    "MEM-ISSUE-G1": "CLOSED_CURRENT_DESIGN",
    "MIQ-FLUSH-G1": "CLOSED_CURRENT_DESIGN",
    "PTW-PMP-G1": "CLOSED_CURRENT_DESIGN",
    "SERIALIZE-G1": "CLOSED_CURRENT_DESIGN",
    "SFENCE-SINVAL-G1": "EXCLUDED_BY_COHORT",
    "STORE-BRESP-G1": "CLOSED_CURRENT_DESIGN",
    "VECTORED-TRAP-G1": "CLOSED_CURRENT_DESIGN",
    "WFI-G1": "EXCLUDED_BY_COHORT",
    "XRET-G1": "CLOSED_CURRENT_DESIGN"
  },
  "design_id": "sha256:337de8bf9bb72a57ab50570313521cd282c49f88df9cb88417c47673af4a6968",
  "evidence_reuse_contract": {
    "artifact_state": "PATH_SHA256_SIZE_BOUND",
    "assertion_state": "POSITIVE_ZERO_FAILURE_AND_NEGATIVE_REJECTION_REQUIRED",
    "delta_state": "PER_FILE_SHA_PLUS_CURRENT_CHANGED_CONE_REPLAY",
    "execution_state": "ORIGINAL_STATUS_IMMUTABLE",
    "historical_design_state": "IMMUTABLE_BASELINE_093C",
    "oracle_state": "CHECKER_REPLAY_VERSIONED_WHEN_EXECUTION_INPUTS_ARE_COMPLETE",
    "receipt_builder_state": "NO_RTL_SIMULATOR_LAUNCHED",
    "rerun_on": [
      "production_or_elaborated_rtl_change_outside_bound_delta",
      "active_device_model_or_simulator_semantics_change",
      "configuration_or_workload_identity_change",
      "missing_raw_terminal_assertion_or_post_hash_evidence"
    ]
  },
  "excluded_debts": [
    "A-COHERENCE-G1",
    "DEBUG-TRIGGER-G1",
    "SFENCE-SINVAL-G1",
    "WFI-G1"
  ],
  "inputs": {
    "architecture_binding_tool": {
      "path": "npc/rv64/eval/ppa/tools/architecture_hard_gates.py",
      "sha256": "4f0b3a55f8ccaef525ef3fc3e8ca4e5bc2d7ee71c885168e5f185f6b5749d274",
      "size_bytes": 125852
    },
    "cohort_scope": {
      "path": "npc/rv64/design/arch/full-core-cohort-scope-v1.md",
      "sha256": "7ebb0a27bdabd4fb68ba3ae41d5ddb20e59ac2873649a659c494385a174aeb85",
      "size_bytes": 4104
    },
    "delta_rebind": {
      "path": "npc/rv64/eval/ppa/evidence/architecture-debt-delta-rebind-current.json",
      "sha256": "c0eb84ea1732aad9812d2eaa49fd32b3c5388b5bd6eb2329d6dc5e5caf956edd",
      "size_bytes": 163684
    },
    "delta_rebind_tool": {
      "path": "npc/rv64/eval/ppa/tools/architecture_debt_delta_rebind.py",
      "sha256": "b82fd3d13dd2bbb50696ee7e7182acd43866573816e4f9af10e804eac9944578",
      "size_bytes": 38691
    },
    "exclusion_a-coherence-g1": {
      "path": "npc/rv64/design/arch/cohort/a-coherence-g1-exclusion.json",
      "sha256": "6f368b4960bed3a6384f83084bea11d966bd1175bf10616bc4816e7aa80a50bc",
      "size_bytes": 476
    },
    "exclusion_debug-trigger-g1": {
      "path": "npc/rv64/design/arch/cohort/debug-trigger-g1-exclusion.json",
      "sha256": "46f803e72e578606f8e4a37876b34713d72c0b56e535e390346c242f7ea5ac13",
      "size_bytes": 446
    },
    "exclusion_sfence-sinval-g1": {
      "path": "npc/rv64/design/arch/cohort/sfence-sinval-g1-exclusion.json",
      "sha256": "532cb7d680b4e9f1e6dbda6d97c21dce6fcea858a4f3089890c9c961dcc59fd8",
      "size_bytes": 480
    },
    "exclusion_wfi-g1": {
      "path": "npc/rv64/design/arch/cohort/wfi-g1-exclusion.json",
      "sha256": "ca635960dec1b6f3b18128785c69465d33ead9b9cfa44af2ab8b3dd24fff4fff",
      "size_bytes": 447
    },
    "global_holder_receipt": {
      "path": "npc/rv64/eval/ppa/evidence/global-producer-no-live-reuse-current.json",
      "sha256": "ce4bfaf09ed0bdd28fc8e69c176d90fc02d1189a3f2358db08c33f54b9839a1c",
      "size_bytes": 81779
    },
    "global_holder_tool": {
      "path": "npc/rv64/eval/ppa/tools/global_producer_no_live_reuse.py",
      "sha256": "7c7812861ae85434e058c058c9866e5e1e90f69ed9656f137577f2f255fc82c8",
      "size_bytes": 54979
    },
    "layered_system": {
      "path": "npc/rv64/eval/ppa/evidence/system-recertification-current.json",
      "sha256": "99fe31b9bba8128277cb1c158154888f062b3e71f85eefdf498631142884873d",
      "size_bytes": 2714
    },
    "legacy_v14e_a1_status": {
      "path": ".github/task-runs/2026-08-02-rv64-v14e-p1-remaining-current-rebind-v1/rootfs-093c2380-systemd-strict-6b-v14e-a1.status",
      "sha256": "b207829e89d94ab92fd4c8ce58d599e101428b3511afcd2e0d19af14a4137b2b",
      "size_bytes": 71
    },
    "legacy_v14e_a2_status": {
      "path": ".github/task-runs/2026-08-02-rv64-v14e-p1-remaining-current-rebind-v1/rootfs-093c2380-systemd-strict-6b-v14e-a2.status",
      "sha256": "c26de83abdc9496cd1301470918ec39ecca1cf389ef0ae1c6504da1800d1c431",
      "size_bytes": 5
    },
    "receipt_schema": {
      "path": "npc/rv64/eval/ppa/schemas/architecture-debt-current-v2.schema.json",
      "sha256": "0acfe2c19ebafbc00f5c9d72a4d4ba51aec2f47ae16360284925146928a27357",
      "size_bytes": 3363
    },
    "receipt_tool": {
      "path": "npc/rv64/eval/ppa/tools/architecture_debt_current.py",
      "sha256": "de1524b6cc58c37cf84343837a80b75f09002e1a1483848bf47881f9f9c63d5f",
      "size_bytes": 47075
    },
    "system_tool": {
      "path": "npc/rv64/eval/ppa/tools/system_recertification_current.py",
      "sha256": "ccd47e1051f49488204169956c38327854da57f80d96c52549576484772793c8",
      "size_bytes": 15712
    },
    "v14c_p0": {
      "path": ".github/task-runs/2026-08-02-rv64-v14c-p0-transitive-current-rebind-v1/evidence/p0-final-2/receipt.json",
      "sha256": "fcdd381611fe3e9c7952913b4f868b10507c8352505250cd2387837aca8aa2e5",
      "size_bytes": 12410
    },
    "v14d_p1_direct": {
      "path": ".github/task-runs/2026-08-02-rv64-v14d-p1-direct-current-rebind-v1/evidence/p1-direct-1/receipt.json",
      "sha256": "f21f8fdea698572ad7b196d9057bac027112ba9356215feb68ecec9e65726cd3",
      "size_bytes": 63240
    },
    "v14e_f0": {
      "path": ".github/task-runs/2026-08-02-rv64-v14e-p1-remaining-current-rebind-v1/evidence/f0-run-6/summary.json",
      "sha256": "76fa6cb340c373fb0466c47a3bf81b9e6277f9b3b56f6156983c48362972643a",
      "size_bytes": 149626
    },
    "v14e_fence": {
      "path": ".github/task-runs/2026-08-02-rv64-v14e-p1-remaining-current-rebind-v1/evidence/fence-run-1/summary.json",
      "sha256": "95ee33bf79bbb8ab1666467b4f597802b4d93e981ba92894857c29d68af42e76",
      "size_bytes": 19815
    },
    "v14e_serialize_fast": {
      "path": ".github/task-runs/2026-08-02-rv64-v14e-p1-remaining-current-rebind-v1/evidence/serialize-fast-run-1/summary.json",
      "sha256": "4001328d750a1193fc68181aa828b9729b3a56a698598476593c7944ca2ec780",
      "size_bytes": 20431
    },
    "v14e_vectored": {
      "path": ".github/task-runs/2026-08-02-rv64-v14e-p1-remaining-current-rebind-v1/evidence/vectored-run-1/summary.json",
      "sha256": "e2a9f28a9eed873044daa41db1f847e9d21e7759e9136c1307895dd3e3885b71",
      "size_bytes": 21158
    },
    "v14h_holder": {
      "path": "npc/rv64/design/arch/producer-holder-semantic-coverage.json",
      "sha256": "ef8f5404a13194a74ebe02d92031b776a5a60944ceecb8ea808c3b91542c62c0",
      "size_bytes": 205417
    }
  },
  "metrics": {
    "delta_rebind": {
      "artifact_records": 23,
      "baseline_design_id": "sha256:093c2380b997029944aa4462015d83711d7c5f1d52b15b4803c4515a581a7488",
      "changed_rtl_files": 5,
      "changed_rtl_replayed": "19/19",
      "historical_negative": "175/175",
      "positive_only_changed_rtl_files": 3,
      "rtl_files": 146,
      "unchanged_rtl_reused": 152,
      "verification_only_reused": 4
    },
    "v14c_p0": {
      "artifact_records": 4,
      "negative": "121/121",
      "positive": "136/136"
    },
    "v14d_p1_direct": {
      "artifact_records": 31,
      "negative": "24/24",
      "positive": "21/21"
    },
    "v14e_f0": {
      "am": "61/61",
      "artifact_records": 11,
      "module": "113/113",
      "official": "177/177",
      "oracle_negative": "11/11",
      "rtl_negative": "3/3"
    },
    "v14e_fence": {
      "artifact_records": 6,
      "negative": "2/2",
      "positive": "2/2"
    },
    "v14e_serialize_fast": {
      "artifact_records": 5,
      "fast_layer_system": "NOT_RUN_IN_FAST_LAYER",
      "positive": "5/5",
      "rtl_negative": "17/17",
      "verification_negative": "1/1"
    },
    "v14e_vectored": {
      "artifact_records": 7,
      "markers": "7/7",
      "negative": "7/7",
      "positive": "3/3"
    }
  },
  "prerequisites": {
    "cohort_exclusions": {
      "A-COHERENCE-G1": {
        "cohort_id": "full-core-single-hart-rv64-dual-issue-ooo-v1",
        "rationale": "The cohort contains one RV64 hart and no autonomous coherent or exclusive peer that may write the active LR/SC reservation granule; multi-master invalidation and coherent transport are outside this product boundary."
      },
      "DEBUG-TRIGGER-G1": {
        "cohort_id": "full-core-single-hart-rv64-dual-issue-ooo-v1",
        "rationale": "The cohort provides simulation observability and semihost EBREAK only; it does not advertise a RISC-V Debug Module, debug mode, halt or resume transport, or executable trigger action."
      },
      "SFENCE-SINVAL-G1": {
        "cohort_id": "full-core-single-hart-rv64-dual-issue-ooo-v1",